{
  "id": "pasta_local",
  "name": "Pasta local de B-rolls",
  "description": "Exemplo do SDK: busca vídeos por nome numa pasta do seu computador e entrega o arquivo para a prévia.",
  "version": "0.2.0",
  "sdk_api": 1,
  "requires_getbrolls": ">=2.5,<3",
  "entry": "plugin.py",
  "contributes": {"providers": ["pasta_local"], "routes": ["pasta_local"], "commands": ["recentes"]},
  "permissions": {"network": [], "env": ["PASTA_LOCAL_DIR"], "paths": ["~/Movies"]}
}
